"gisaid_epi_isl","strain","date_str","date","region","country","division","country_exposure","nextstrain_clade","pangolin_lineage","originating_lab","submitting_lab","authors","tree_pangolin_lineage","tree_label","travel_context","similarity_context","focal_sequence"
"EPI_ISL_402125","Wuhan/Hu-1/2019","2019-12-26",2019-12-26,"Asia","China","Hubei","China","19A","B","National Institute for Communicable Disease Control and Prevention (ICDC) Chinese Center for Disease Control and Prevention (China CDC)","National Institute for Communicable Disease Control and Prevention (ICDC) Chinese Center for Disease Control and Prevention (China CDC)","Zhang et al","B","EPI_ISL_402125|2019-12-26",FALSE,FALSE,FALSE
"EPI_ISL_406798","Wuhan/WH01/2019","2019-12-26",2019-12-26,"Asia","China","Hubei","China","19A","B","General Hospital of Central Theater Command of People's Liberation Army of China","BGI & Institute of Microbiology, Chinese Academy of Sciences & Shandong First Medical University & Shandong Academy of Medical Sciences & General Hospital of Central Theater Command of People's Liberation Army of China","Weijun Chen et al","B","EPI_ISL_406798|2019-12-26",FALSE,FALSE,FALSE
"EPI_ISL_516561","Switzerland/BL-ETHZ-230018/2020","2020-08-02",2020-08-02,"Europe","Switzerland","Basel-Land","Switzerland","20B","B.1.1.247","Viollier AG","Department of Biosystems Science and Engineering, ETH Zürich","Christian Beisel et al","B.1.1.247","EPI_ISL_516561|2020-08-02",FALSE,FALSE,TRUE
"EPI_ISL_539579","Germany/NW-HHU-102/2020","2020-08-28",2020-08-28,"Europe","Germany","North Rhine Westphalia","Germany","20B","B.1.1.247","ZOTZ KLIMAS MVZ Düsseldorf-Centrum GbR ÜBAG für Labormedizin, Genetik, Zytologie, Pathologie","Center of Medical Microbiology, Virology, and Hospital Hygiene, University of Duesseldorf","Maximilian Damagnez et al","B.1.1.247","EPI_ISL_539579|2020-08-28",TRUE,FALSE,FALSE
"EPI_ISL_560549","Switzerland/ZH-ETHZ-280174/2020","2020-09-08",2020-09-08,"Europe","Switzerland","Zürich","Switzerland","20B","B.1.1.247","Viollier AG","Department of Biosystems Science and Engineering, ETH Zürich","Christian Beisel et al","B.1.1.247","EPI_ISL_560549|2020-09-08",FALSE,FALSE,TRUE
"EPI_ISL_591188","Canada/ON-S1419/2020","2020-08-23",2020-08-23,"North America","Canada","Ontario","Canada","20B","B.1.1.247","Toronto Invasive Bacterial Diseases Network","McMaster University","Allison McGeer et al","B.1.1.247","EPI_ISL_591188|2020-08-23",FALSE,TRUE,FALSE
"EPI_ISL_710564","Croatia/Zagreb-23/2020","2020-09-19",2020-09-19,"Europe","Croatia","Zagreb","Croatia","20B","B.1.1.247","University Hospital Dubrava","Ruđer Boškovic Institute; Forensic Science Centre Ivan Vučetić; University of Zagreb Faculty of Science","Robert Belužić et al","B.1.1.247","EPI_ISL_710564|2020-09-19",TRUE,FALSE,FALSE
