"gisaid_epi_isl","strain","date_str","date","region","country","division","country_exposure","nextstrain_clade","pangolin_lineage","originating_lab","submitting_lab","authors","tree_pangolin_lineage","tree_label","travel_context","similarity_context","focal_sequence"
"EPI_ISL_402125","Wuhan/Hu-1/2019","2019-12-26",2019-12-26,"Asia","China","Hubei","China","19A","B","National Institute for Communicable Disease Control and Prevention (ICDC) Chinese Center for Disease Control and Prevention (China CDC)","National Institute for Communicable Disease Control and Prevention (ICDC) Chinese Center for Disease Control and Prevention (China CDC)","Zhang et al","B","EPI_ISL_402125|2019-12-26",FALSE,FALSE,FALSE
"EPI_ISL_406798","Wuhan/WH01/2019","2019-12-26",2019-12-26,"Asia","China","Hubei","China","19A","B","General Hospital of Central Theater Command of People's Liberation Army of China","BGI & Institute of Microbiology, Chinese Academy of Sciences & Shandong First Medical University & Shandong Academy of Medical Sciences & General Hospital of Central Theater Command of People's Liberation Army of China","Weijun Chen et al","B","EPI_ISL_406798|2019-12-26",FALSE,FALSE,FALSE
"EPI_ISL_523781","Netherlands/ZH-EMC-443/2020","2020-08-12",2020-08-12,"Europe","Netherlands","South Holland","Netherlands","20A","B.1.146","Dutch COVID-19 response team","Erasmus Medical Center","Bas Oude Munnink et al","B.1.146","EPI_ISL_523781|2020-08-12",TRUE,FALSE,FALSE
"EPI_ISL_531384","England/QEUH-96ACF8/2020","2020-08-14",2020-08-14,"Europe","United Kingdom","England","United Kingdom","20B","B.1.146","Lighthouse Lab in Glasgow","Wellcome Sanger Institute for the COVID-19 Genomics UK (COG-UK) consortium","Harper VanSteenhouse et al","B.1.146","EPI_ISL_531384|2020-08-14",FALSE,TRUE,FALSE
"EPI_ISL_535627","Switzerland/BE-ETHZ-250119/2020","2020-08-14",2020-08-14,"Europe","Switzerland","Bern","Switzerland","20A","B.1.146","Viollier AG","Department of Biosystems Science and Engineering, ETH Zürich","Christian Beisel et al","B.1.146","EPI_ISL_535627|2020-08-14",FALSE,FALSE,TRUE
