"gisaid_epi_isl","strain","date_str","date","region","country","division","country_exposure","nextstrain_clade","pangolin_lineage","originating_lab","submitting_lab","authors","tree_pangolin_lineage","tree_label","travel_context","similarity_context","focal_sequence"
"EPI_ISL_402125","Wuhan/Hu-1/2019","2019-12-26",2019-12-26,"Asia","China","Hubei","China","19A","B","National Institute for Communicable Disease Control and Prevention (ICDC) Chinese Center for Disease Control and Prevention (China CDC)","National Institute for Communicable Disease Control and Prevention (ICDC) Chinese Center for Disease Control and Prevention (China CDC)","Zhang et al","B","EPI_ISL_402125|2019-12-26",FALSE,FALSE,FALSE
"EPI_ISL_406798","Wuhan/WH01/2019","2019-12-26",2019-12-26,"Asia","China","Hubei","China","19A","B","General Hospital of Central Theater Command of People's Liberation Army of China","BGI & Institute of Microbiology, Chinese Academy of Sciences & Shandong First Medical University & Shandong Academy of Medical Sciences & General Hospital of Central Theater Command of People's Liberation Army of China","Weijun Chen et al","B","EPI_ISL_406798|2019-12-26",FALSE,FALSE,FALSE
"EPI_ISL_586362","Canada/ON-S1507/2020","2020-08-30",2020-08-30,"North America","Canada","Ontario","Canada","20B","B.1.1.157","Toronto Invasive Bacterial Diseases Network","McMaster University","Allison McGeer et al","B.1.1.157","EPI_ISL_586362|2020-08-30",FALSE,TRUE,FALSE
"EPI_ISL_692741","France/ARA-67659/2020","2020-09-04",2020-09-04,"Europe","France","Auvergne-Rhône-Alpes","France","20B","B.1.1.157","CNR Virus des Infections Respiratoires - France SUD","CNR Virus des Infections Respiratoires - France SUD","Antonin Bal et al","B.1.1.157","EPI_ISL_692741|2020-09-04",TRUE,FALSE,FALSE
"EPI_ISL_830810","Switzerland/BS-42444469/2020","2020-09-17",2020-09-17,"Europe","Switzerland","Basel-Stadt","Switzerland","20B","B.1.1.157","University Hospital Basel, Clinical Virology","University Hospital Basel, Clinical Bacteriology","Tim Roloff et al","B.1.1.157","EPI_ISL_830810|2020-09-17",FALSE,FALSE,TRUE
